36123438-Anti-phage-defense-Ecoli/data/blast_results_summary.json

{
  "PD-T4-10": {
    "total_hits": 11,
    "ecoli_hits": 9,
    "unique_species": 3,
    "species": {
      "Escherichia coli": {
        "count": 9,
        "max_identity": 100.0,
        "min_evalue": 9.02421e-127
      },
      "Enterobacteriaceae": {
        "count": 1,
        "max_identity": 100.0,
        "min_evalue": 2.94579e-127
      },
      "Citrobacter freundii complex": {
        "count": 1,
        "max_identity": 90.64327485380117,
        "min_evalue": 2.6754e-115
      }
    }
  },
  "PD-T4-4": {
    "total_hits": 100,
    "ecoli_hits": 88,
    "unique_species": 10,
    "species": {
      "Escherichia coli": {
        "count": 88,
        "max_identity": 100.0,
        "min_evalue": 0
      },
      "Klebsiella pneumoniae": {
        "count": 3,
        "max_identity": 99.14346895074947,
        "min_evalue": 0
      },
      "Escherichia": {
        "count": 2,
        "max_identity": 28.30188679245283,
        "min_evalue": 5.86078e-51
      },
      "Pseudomonadota": {
        "count": 1,
        "max_identity": 100.0,
        "min_evalue": 0
      },
      "Citrobacter": {
        "count": 1,
        "max_identity": 46.496815286624205,
        "min_evalue": 2.46922e-145
      },
      "Shigella sonnei": {
        "count": 1,
        "max_identity": 27.835051546391753,
        "min_evalue": 4.78197e-42
      },
      "Enterobacteriaceae": {
        "count": 1,
        "max_identity": 23.943661971830984,
        "min_evalue": 1.18997e-35
      },
      "Enterobacterales": {
        "count": 1,
        "max_identity": 26.54462242562929,
        "min_evalue": 4.00647e-35
      },
      "Escherichia albertii": {
        "count": 1,
        "max_identity": 24.336283185840706,
        "min_evalue": 1.77784e-34
      },
      "Escherichia marmotae": {
        "count": 1,
        "max_identity": 24.778761061946902,
        "min_evalue": 1.83367e-32
      }
    }
  },
  "PD-T4-6": {
    "total_hits": 24,
    "ecoli_hits": 24,
    "unique_species": 1,
    "species": {
      "Escherichia coli": {
        "count": 24,
        "max_identity": 100.0,
        "min_evalue": 0
      }
    }
  },
  "PD-T4-7": {
    "total_hits": 100,
    "ecoli_hits": 94,
    "unique_species": 5,
    "species": {
      "Escherichia coli": {
        "count": 93,
        "max_identity": 100.0,
        "min_evalue": 0
      },
      "Enterobacteriaceae": {
        "count": 3,
        "max_identity": 99.7159090909091,
        "min_evalue": 0
      },
      "Salmonella enterica": {
        "count": 2,
        "max_identity": 100.0,
        "min_evalue": 0
      },
      "Escherichia": {
        "count": 1,
        "max_identity": 99.43181818181817,
        "min_evalue": 0
      },
      "Escherichia coli O5": {
        "count": 1,
        "max_identity": 99.43181818181817,
        "min_evalue": 0
      }
    }
  },
  "PD-T4-9": {
    "total_hits": 17,
    "ecoli_hits": 12,
    "unique_species": 6,
    "species": {
      "Escherichia coli": {
        "count": 12,
        "max_identity": 100.0,
        "min_evalue": 1.23e-143
      },
      "Enterobacteriaceae": {
        "count": 1,
        "max_identity": 99.47916666666666,
        "min_evalue": 6.59405e-143
      },
      "Escherichia": {
        "count": 1,
        "max_identity": 93.65079365079364,
        "min_evalue": 8.05339e-133
      },
      "Citrobacter": {
        "count": 1,
        "max_identity": 58.730158730158735,
        "min_evalue": 6.31284e-73
      },
      "Klebsiella": {
        "count": 1,
        "max_identity": 52.74725274725275,
        "min_evalue": 3.03368e-68
      },
      "Enterobacterales": {
        "count": 1,
        "max_identity": 32.7683615819209,
        "min_evalue": 1.41261e-20
      }
    }
  },
  "PD-T7-1": {
    "total_hits": 100,
    "ecoli_hits": 95,
    "unique_species": 3,
    "species": {
      "Escherichia coli": {
        "count": 95,
        "max_identity": 100.0,
        "min_evalue": 0
      },
      "Escherichia": {
        "count": 3,
        "max_identity": 99.55456570155901,
        "min_evalue": 0
      },
      "Enterobacteriaceae": {
        "count": 2,
        "max_identity": 59.7752808988764,
        "min_evalue": 0
      }
    }
  },
  "PD-T7-2": {
    "total_hits": 100,
    "ecoli_hits": 85,
    "unique_species": 9,
    "species": {
      "Escherichia coli": {
        "count": 85,
        "max_identity": 100.0,
        "min_evalue": 0
      },
      "Enterobacteriaceae": {
        "count": 6,
        "max_identity": 29.53846153846154,
        "min_evalue": 3.85483e-24
      },
      "Gammaproteobacteria": {
        "count": 3,
        "max_identity": 98.75,
        "min_evalue": 0
      },
      "Klebsiella pneumoniae": {
        "count": 1,
        "max_identity": 99.6875,
        "min_evalue": 0
      },
      "Enterobacterales": {
        "count": 1,
        "max_identity": 99.6875,
        "min_evalue": 0
      },
      "Salmonella enterica subsp. enterica serovar Mbandaka": {
        "count": 1,
        "max_identity": 98.75,
        "min_evalue": 0
      },
      "Klebsiella": {
        "count": 1,
        "max_identity": 98.4375,
        "min_evalue": 0
      },
      "Escherichia sp. 584": {
        "count": 1,
        "max_identity": 29.32098765432099,
        "min_evalue": 4.86156e-25
      },
      "Salmonella enterica": {
        "count": 1,
        "max_identity": 27.1356783919598,
        "min_evalue": 1.86016e-08
      }
    }
  },
  "PD-T7-3": {
    "total_hits": 100,
    "ecoli_hits": 97,
    "unique_species": 4,
    "species": {
      "Escherichia coli": {
        "count": 96,
        "max_identity": 100.0,
        "min_evalue": 0
      },
      "Enterobacteriaceae": {
        "count": 2,
        "max_identity": 100.0,
        "min_evalue": 0
      },
      "Escherichia coli O144": {
        "count": 1,
        "max_identity": 100.0,
        "min_evalue": 0
      },
      "Escherichia": {
        "count": 1,
        "max_identity": 100.0,
        "min_evalue": 0
      }
    }
  },
  "PD-T7-5": {
    "total_hits": 100,
    "ecoli_hits": 98,
    "unique_species": 3,
    "species": {
      "Escherichia coli": {
        "count": 98,
        "max_identity": 100.0,
        "min_evalue": 0
      },
      "Enterobacter roggenkampii": {
        "count": 1,
        "max_identity": 100.0,
        "min_evalue": 0
      },
      "Enterobacteriaceae": {
        "count": 1,
        "max_identity": 100.0,
        "min_evalue": 0
      }
    }
  },
  "PD-##-2": {
    "total_hits": 13,
    "ecoli_hits": 5,
    "unique_species": 6,
    "species": {
      "Escherichia coli": {
        "count": 4,
        "max_identity": 100.0,
        "min_evalue": 1.83369e-62
      },
      "Enterobacteriaceae": {
        "count": 4,
        "max_identity": 96.73913043478261,
        "min_evalue": 9.17878e-61
      },
      "Enterobacterales": {
        "count": 2,
        "max_identity": 97.82608695652173,
        "min_evalue": 1.97296e-61
      },
      "Escherichia": {
        "count": 1,
        "max_identity": 100.0,
        "min_evalue": 2.00972e-62
      },
      "Escherichia coli 2-011-08_S1_C3": {
        "count": 1,
        "max_identity": 98.0,
        "min_evalue": 5.11737e-29
      },
      "Escherichia fergusonii": {
        "count": 1,
        "max_identity": 45.23809523809524,
        "min_evalue": 2.31011e-19
      }
    }
  },
  "PD-##-3": {
    "total_hits": 68,
    "ecoli_hits": 53,
    "unique_species": 8,
    "species": {
      "Escherichia coli": {
        "count": 52,
        "max_identity": 100.0,
        "min_evalue": 3.70977e-116
      },
      "Enterobacterales": {
        "count": 7,
        "max_identity": 98.74213836477988,
        "min_evalue": 8.01766e-115
      },
      "Klebsiella pneumoniae": {
        "count": 3,
        "max_identity": 100.0,
        "min_evalue": 1.66425e-99
      },
      "Enterobacteriaceae": {
        "count": 2,
        "max_identity": 89.937106918239,
        "min_evalue": 9.80088e-102
      },
      "Pseudomonadota": {
        "count": 1,
        "max_identity": 100.0,
        "min_evalue": 2.2638e-116
      },
      "Citrobacter freundii GTC 09629": {
        "count": 1,
        "max_identity": 89.937106918239,
        "min_evalue": 2.30649e-102
      },
      "Salmonella enterica subsp. enterica serovar Montevideo str. 507440-20": {
        "count": 1,
        "max_identity": 99.28571428571429,
        "min_evalue": 1.10486e-99
      },
      "Escherichia coli P12b": {
        "count": 1,
        "max_identity": 100.0,
        "min_evalue": 6.37753e-77
      }
    }
  },
  "PD-##-4": {
    "total_hits": 100,
    "ecoli_hits": 98,
    "unique_species": 2,
    "species": {
      "Escherichia coli": {
        "count": 98,
        "max_identity": 99.92205767731879,
        "min_evalue": 0
      },
      "Enterobacteriaceae": {
        "count": 2,
        "max_identity": 100.0,
        "min_evalue": 0
      }
    }
  },
  "PD-##-5": {
    "total_hits": 100,
    "ecoli_hits": 98,
    "unique_species": 4,
    "species": {
      "Escherichia coli": {
        "count": 97,
        "max_identity": 100.0,
        "min_evalue": 0
      },
      "Enterobacteriaceae": {
        "count": 1,
        "max_identity": 100.0,
        "min_evalue": 0
      },
      "Escherichia": {
        "count": 1,
        "max_identity": 99.20159680638723,
        "min_evalue": 0
      },
      "Escherichia coli MS 185-1": {
        "count": 1,
        "max_identity": 96.69260700389106,
        "min_evalue": 0
      }
    }
  },
  "PD-##-6": {
    "total_hits": 25,
    "ecoli_hits": 22,
    "unique_species": 3,
    "species": {
      "Escherichia coli": {
        "count": 21,
        "max_identity": 100.0,
        "min_evalue": 9.17901e-93
      },
      "Enterobacteriaceae": {
        "count": 3,
        "max_identity": 100.0,
        "min_evalue": 5.91693e-93
      },
      "Escherichia coli 3431": {
        "count": 1,
        "max_identity": 100.0,
        "min_evalue": 4.18474e-25
      }
    }
  }
}

BVBRC-07-Sherry-AMR-workflow-2023/extraction/marker.md

validation of bioinformatic analytical tools for the detection of AMR is                          validation dataset could be adopted for use in public health and clin-
crucial4,12. Another hurdle to the acceptance and implementation of                               ical sequencing laboratories to assist those involved in AMR surveil-
AMR genomics is how the data can be meaningfully reported outside                                 lance and clinical applications.
of research or reference laboratory settings4. If the implementation of
WGS for AMR is going to be accepted for the detection of AMR resis-                               Results
tance, it is important to consider the way in which complex genomic                               The abritAMR bioinformatics pipeline
data is presented to clinicians, nurses, public health surveillance                               abritAMR is a pipeline for characterisation and reporting of AMR
teams, and other stakeholders with varying understanding of geno-                                 determinants from bacterial sequences, adapting the AMRFinderPlus
mics, and thus how to interpret ﬁndings13. This is a gap in the bioin-                            tool and database for use in clinical and public health microbiology.
formatic tools currently available for AMR, as outputs are not usually                            Using the outputs from AMRFinderPlus, AMR mechanisms are further
tailored for clinical reports, or easily modiﬁable to suit local reporting                        classiﬁed by antimicrobial class and/or mechanism to suit clinical and
requirements.                                                                                     public health microbiology (CPHM) needs, and subsequently ﬁltered
     In many countries, clinical and public health microbiology                                   according to local reporting requirements, with results ready for
laboratories are required to meet International Standards Organiza-                               incorporation into sample reports (overview Fig. 1, outputs Fig. 2;
tion (ISO), or ISO-equivalent, standards to be accredited to operate14.                           further details available in Methods and Supplementary Figure 1). An
These standards require the implementation of standardised operat-                                additional module generates inferred susceptibility results (currently
ing procedures, quality management systems, staff training and rig-                               validated for Salmonella spp.; output Fig. 2, reporting logic detailed in
orous validation of all processes used to generate results and reports in                         Supplementary Figure 2).
each laboratory15. Currently, the relevant standards for medical
laboratories (last released in 2012) are not designed to assess the                               Validation of the abritAMR pipeline: overview
performance of bioinformatic tools, making validation to meet these                               To validate the abritAMR pipeline, we compared performance to PCR
standards difﬁcult for laboratories, in addition to the paucity of                                results for key AMR genes, to AMRFinderPlus results on synthetic read
publicly-available validation datasets4.                                                          data from reference genomes, and to phenotypic data for Salmonella
     Here we design and validate a bioinformatic tool, abritAMR, a                                spp. (Fig. 3).
wrapper for the NCBI AMRFinderPlus tool16 for the detection of AMR                                     abritAMR performed very well against the four validation panels,
determinants from whole genome sequencing data16, with outputs                                    with an overall accuracy of 99.9% (95% CI 99.9–99.9%), sensitivity
adapted for clinical and public health microbiology reporting. We                                 97.9% (97.5-98.4%), and speciﬁcity 100% (100-100%) (Table 1). Impor-
envisage that this pipeline, extensive validation methods and                                     tantly, the abritAMR pipeline was reliable for the high-risk AMR gene

content (leading to lower sequence coverage) in these genes. The                       Validation of inferred antibiogram (Salmonella spp.)
other major theme was difﬁculty resolving sequences with multiple                      Validation of inferred phenotype against phenotypic AST data
alleles of the same gene family, which were often collapsed into a                     demonstrated 98.9% accuracy (95% CI 98.7–99.1%), 98.9% sensitivity
single gene detection by abritAMR or miscalled as a different allele. For              (98.4–99.3) and 98.9% speciﬁcity (98.7–99.1%) overall (Table 1, Sup-
example, this included a sequence with CTX-M-3, CTX-M-14 and CTX-                      plementary Table 2 and Fig. 6). Accuracy of phenotypic inference was
M-65 identiﬁed by AMRFinderPlus, and called as CTX-M-3 and CTX-M-                      ≥98% for 11/13 antimicrobials (85%), with lower accuracy identiﬁed for
24 by abritAMR. Four out of the ﬁve ‘false positive’ detections were                   streptomycin (95.5%, 95% CI 93.7–96.9%) and ciproﬂoxacin (96.8%,
actually allele miscalls within the same gene family. Collapse of repe-                95% CI 95.4–97.8%), similar to previous ﬁndings using different
ated regions or duplicate alleles is often a feature of short-read                     bioinformatic methods21.
sequencing, hence the discrepancies here may be a feature of com-                           A number of ‘false positive’ results were identiﬁed for strepto-
paring (synthetic) short-read data to complete genomes, rather than a                  mycin (resistant genotype [AMR genes or mutations detected], sus-
feature of abritAMR. Notably, use of alternative genome assembly tools                 ceptible phenotype; n = 30/716 (4.2%) isolates). The AMR genes
(SKESA18 and SPAdes19) did not resolve the discrepancies, with similar                 detected in phenotypically susceptible isolates were also detected in
performance to Shovill20 (based on SPAdes; Supplementary Table 1).                     non-susceptible isolates, although the non-susceptible isolates more
                                                                                       often had >1 AMR gene (1 AMR gene, 22% phenotypically resistant; 2 or
Limit of detection and precision                                                       more AMR genes, 81.4% phenotypically resistant), suggesting that
The limit of detection of the abritAMR pipeline was assessed to                        these AMR mechanisms had small but additive effects on phenotype.
determine the minimum average sequencing depth for acceptable                          Evaluation of phenotype-genotype concordance for azithromycin
accuracy of AMR gene detection (as required for clinical microbiology                  identiﬁed ﬁve ‘false negatives’ (susceptible phenotype, no AMR
validation and accreditation). Accuracy was found to be consistent                     mechanism detected) and two ‘false positives’ (AMR mechanism
(99.9%) across the 40X to 150X range, with 40X being the minimum                       detected but phenotypically susceptible; neither isolate carried the
coverage accepted by our accredited quality control (QC) pipeline.                     dominant resistance mechanism for azithromycin in Salmonella spp.
Repeatability and reproducibility (precision) were assessed (replicates                (mph(A); one carried mef(B), an efﬂux pump with variable activity, and
within and across sequencing runs) and found to be 100% concordant.                    one carried ere(A), an esterase with lower afﬁnity for azithromycin22).