BVBRC-85-Saureus-SO1977-Sudan-Ali2019/report/evidence/abricate_victors.tsv

#FILE	SEQUENCE	START	END	STRAND	GENE	COVERAGE	COVERAGE_MAP	GAPS	%COVERAGE	%IDENTITY	DATABASE	ACCESSION	PRODUCT	RESISTANCE
../downloads/SO1977_genomic.fna	NFZY01000004.1	48715	49137	+	gi|29165615:1657619-1658041	1-423/423	===============	0/0	100.00	99.76	victors	gi|29165615:1657619-1658041	Staphylococcus aureus subsp. aureus N315 complete genome	
../downloads/SO1977_genomic.fna	NFZY01000004.1	91033	92295	+	gi|29165615:1706140-1707402	1-1263/1263	===============	0/0	100.00	99.45	victors	gi|29165615:1706140-1707402	Staphylococcus aureus subsp. aureus N315 complete genome	
../downloads/SO1977_genomic.fna	NFZY01000006.1	36779	38968	+	gi|29165615:1044833-1047022	1-2190/2190	===============	0/0	100.00	97.17	victors	gi|29165615:1044833-1047022	Staphylococcus aureus subsp. aureus N315 complete genome	
../downloads/SO1977_genomic.fna	NFZY01000007.1	17835	18278	+	gi|156978331:761110-761553	1-444/444	===============	0/0	100.00	99.78	victors	gi|156978331:761110-761553	Staphylococcus aureus subsp. aureus Mu3 complete genome	
../downloads/SO1977_genomic.fna	NFZY01000008.1	24446	25435	+	gi|151220212:1813145-1814134	1-990/990	===============	0/0	100.00	97.98	victors	gi|151220212:1813145-1814134	Staphylococcus aureus subsp. aureus str. Newman complete genome	
../downloads/SO1977_genomic.fna	NFZY01000009.1	77219	78811	+	gi|29165615:233344-234936	1-1593/1593	===============	0/0	100.00	98.05	victors	gi|29165615:233344-234936	Staphylococcus aureus subsp. aureus N315 complete genome	
../downloads/SO1977_genomic.fna	NFZY01000010.1	922	2187	-	gi|29165615:1406728-1407993	1-1266/1266	===============	0/0	100.00	97.31	victors	gi|29165615:1406728-1407993	Staphylococcus aureus subsp. aureus N315 complete genome	
../downloads/SO1977_genomic.fna	NFZY01000010.1	6915	7904	-	gi|29165615:1401011-1402000	1-990/990	===============	0/0	100.00	95.45	victors	gi|29165615:1401011-1402000	Staphylococcus aureus subsp. aureus N315 complete genome	
../downloads/SO1977_genomic.fna	NFZY01000010.1	21950	22780	-	gi|29165615:1385874-1386704	1-831/831	===============	0/0	100.00	99.40	victors	gi|29165615:1385874-1386704	Staphylococcus aureus subsp. aureus N315 complete genome	
../downloads/SO1977_genomic.fna	NFZY01000010.1	26297	27556	-	gi|29165615:1380484-1381743	1-1260/1260	===============	0/0	100.00	98.97	victors	gi|29165615:1380484-1381743	Staphylococcus aureus subsp. aureus N315 complete genome	
../downloads/SO1977_genomic.fna	NFZY01000010.1	27575	28837	-	gi|88193823:1317075-1318337	1-1263/1263	===============	0/0	100.00	99.05	victors	gi|88193823:1317075-1318337	Staphylococcus aureus subsp. aureus NCTC 8325 chromosome complete genome	
../downloads/SO1977_genomic.fna	NFZY01000010.1	29161	29889	-	gi|29165615:1378153-1378881	1-729/729	===============	0/0	100.00	90.67	victors	gi|29165615:1378153-1378881	Staphylococcus aureus subsp. aureus N315 complete genome	
../downloads/SO1977_genomic.fna	NFZY01000010.1	29882	31096	-	gi|29165615:1376946-1378160	1-1215/1215	===============	0/0	100.00	91.52	victors	gi|29165615:1376946-1378160	Staphylococcus aureus subsp. aureus N315 complete genome	
../downloads/SO1977_genomic.fna	NFZY01000010.1	32505	33502	-	gi|29165615:1374539-1375537	2-999/999	===============	0/0	99.90	88.78	victors	gi|29165615:1374539-1375537	Staphylococcus aureus subsp. aureus N315 complete genome	
../downloads/SO1977_genomic.fna	NFZY01000010.1	40077	41060	-	gi|29165615:1366982-1367965	1-984/984	===============	0/0	100.00	99.29	victors	gi|29165615:1366982-1367965	Staphylococcus aureus subsp. aureus N315 complete genome	
../downloads/SO1977_genomic.fna	NFZY01000010.1	41197	41706	-	gi|29165615:1366336-1366845	1-510/510	===============	0/0	100.00	99.22	victors	gi|29165615:1366336-1366845	Staphylococcus aureus subsp. aureus N315 complete genome	
../downloads/SO1977_genomic.fna	NFZY01000010.1	41909	44431	-	gi|49482253:1427046-1429568	1-2523/2523	===============	0/0	100.00	98.93	victors	gi|49482253:1427046-1429568	Staphylococcus aureus subsp. aureus MRSA252 chromosome complete genome	
../downloads/SO1977_genomic.fna	NFZY01000010.1	56049	58754	-	gi|29165615:1349288-1351993	1-2706/2706	===============	0/0	100.00	98.89	victors	gi|29165615:1349288-1351993	Staphylococcus aureus subsp. aureus N315 complete genome	
../downloads/SO1977_genomic.fna	NFZY01000010.1	79325	80239	-	gi|29165615:1327840-1328754	1-915/915	===============	0/0	100.00	97.16	victors	gi|29165615:1327840-1328754	Staphylococcus aureus subsp. aureus N315 complete genome	
../downloads/SO1977_genomic.fna	NFZY01000012.1	5610	6353	+	gi|29165615:1201643-1202386	1-744/744	===============	0/0	100.00	99.73	victors	gi|29165615:1201643-1202386	Staphylococcus aureus subsp. aureus N315 complete genome	
../downloads/SO1977_genomic.fna	NFZY01000012.1	6350	8344	+	gi|29165615:1202383-1204377	1-1995/1995	===============	0/0	100.00	98.75	victors	gi|29165615:1202383-1204377	Staphylococcus aureus subsp. aureus N315 complete genome	
../downloads/SO1977_genomic.fna	NFZY01000015.1	17230	18009	+	gi|156978331:973824-974603	1-780/780	===============	0/0	100.00	97.44	victors	gi|156978331:973824-974603	Staphylococcus aureus subsp. aureus Mu3 complete genome	
../downloads/SO1977_genomic.fna	NFZY01000016.1	39192	40292	+	gi|151220212:1217813-1218913	1-1101/1101	===============	0/0	100.00	99.64	victors	gi|151220212:1217813-1218913	Staphylococcus aureus subsp. aureus str. Newman complete genome	
../downloads/SO1977_genomic.fna	NFZY01000018.1	14287	15330	+	gi|29165615:1280569-1281612	1-1044/1044	===============	0/0	100.00	99.42	victors	gi|29165615:1280569-1281612	Staphylococcus aureus subsp. aureus N315 complete genome	
../downloads/SO1977_genomic.fna	NFZY01000021.1	26225	27349	-	gi|29165615:1434417-1435541	1-1125/1125	===============	0/0	100.00	96.80	victors	gi|29165615:1434417-1435541	Staphylococcus aureus subsp. aureus N315 complete genome	
../downloads/SO1977_genomic.fna	NFZY01000030.1	8652	10616	-	gi|151220212:2657324-2659288	1-1965/1965	===============	0/0	100.00	89.92	victors	gi|151220212:2657324-2659288	Staphylococcus aureus subsp. aureus str. Newman complete genome	
../downloads/SO1977_genomic.fna	NFZY01000033.1	9742	11037	-	gi|151220212:535240-536535	1-1296/1296	===============	0/0	100.00	98.61	victors	gi|151220212:535240-536535	Staphylococcus aureus subsp. aureus str. Newman complete genome	
../downloads/SO1977_genomic.fna	NFZY01000035.1	2589	3887	-	gi|269201690:1517365-1518663	1-1299/1299	===============	0/0	100.00	91.22	victors	gi|269201690:1517365-1518663	Staphylococcus aureus subsp. aureus ED98 complete genome	
../downloads/SO1977_genomic.fna	NFZY01000035.1	11295	13988	-	gi|29165615:1493027-1495720	1-2694/2694	===============	0/0	100.00	99.22	victors	gi|29165615:1493027-1495720	Staphylococcus aureus subsp. aureus N315 complete genome	
../downloads/SO1977_genomic.fna	NFZY01000040.1	407	1366	-	gi|151220212:1176264-1177223	1-960/960	===============	0/0	100.00	95.21	victors	gi|151220212:1176264-1177223	Staphylococcus aureus subsp. aureus str. Newman chromosome complete genome	
../downloads/SO1977_genomic.fna	NFZY01000047.1	6238	7320	+	gi|29165615:960027-961109	1-1083/1083	===============	0/0	100.00	99.35	victors	gi|29165615:960027-961109	Staphylococcus aureus subsp. aureus N315 complete genome	
../downloads/SO1977_genomic.fna	NFZY01000052.1	3351	4694	+	gi|29165615:1411831-1413174	1-1344/1344	===============	0/0	100.00	98.96	victors	gi|29165615:1411831-1413174	Staphylococcus aureus subsp. aureus N315 complete genome	
../downloads/SO1977_genomic.fna	NFZY01000052.1	9411	10682	+	gi|29165615:1417893-1419161	1-1269/1269	========/======	1/3	100.00	98.11	victors	gi|29165615:1417893-1419161	Staphylococcus aureus subsp. aureus N315 complete genome

BVBRC-07-Sherry-AMR-workflow-2023/extraction/marker.md

1234567890():,;   1234567890():,;
                                                                                          Realising the promise of genomics to revolutionise identiﬁcation and surveil-
                                                                                          lance of antimicrobial resistance (AMR) has been a long-standing challenge in
                                                                                          clinical and public health microbiology. Here, we report the creation and
                                                                                          validation of abritAMR, an ISO-certiﬁed bioinformatics platform for genomics-
                                                                                          based bacterial AMR gene detection. The abritAMR platform utilises NCBI’s
                                                                                          AMRFinderPlus, as well as additional features that classify AMR determinants
                                                                                          into antibiotic classes and provide customised reports. We validate abritAMR
                                                                                          by comparing with PCR or reference genomes, representing 1500 different
                                                                                          bacteria and 415 resistance alleles. In these analyses, abritAMR displays 99.9%
                                                                                          accuracy, 97.9% sensitivity and 100% speciﬁcity. We also compared genomic
                                                                                          predictions of phenotype for 864 Salmonella spp. against agar dilution results,
                                                                                          showing 98.9% accuracy. The implementation of abritAMR in our institution
                                                                                          has resulted in streamlined bioinformatics and reporting pathways, and has
                                                                                          been readily updated and re-veriﬁed. The abritAMR tool and validation data-
                                                                                          sets are publicly available to assist laboratories everywhere harness the power
                                                                                          of AMR genomics in professional practice.

classes that are notiﬁable as part of our national critical antimicrobial              suspected CPE isolates such as these), as different colonies with and
resistance surveillance system (CARAlert) in Australia17, with 99.9%                   without the ESBL/AmpC gene may have been picked for PCR and WGS,
accuracy (95% CI 99.9–100%), 98.9% sensitivity (98.3–99.3%) and 100%                   potentially explaining these discrepancies. No discrepant results were
speciﬁcity (100–100%) across these classes (carbapenemases, 16 S                       detected for mecA and van gene detection, and only one allele was
ribosomal methyltransferases, mobile colistin resistance genes, ESBLs                  incorrectly assigned compared to Sanger sequencing (99.7% accuracy)
(including AmpCs), vancomycin resistance genes, and oxazolidinone                      (Table 1 and Fig. 4). Overall performance of abritAMR against PCR
and phenicol resistance (optrA, cfr and poxtA genes)).                                 yielded 99.6% accuracy (95% CI 99.0-99.9%), 99.6% sensitivity (99.0-
                                                                                       99.9%) and 99.4% speciﬁcity (97.9-99.9%).
Validation results compared to PCR and Sanger sequencing
The abritAMR pipeline was highly accurate compared to PCR (carba-                      Identiﬁcation of AMR genes from synthetic reads
penemase, ESBL, van and mec gene PCRs) with 1179/1184 (99.6%)                          The presence or absence of 415 AMR genes across 321 genomes (133215
resistance genes correctly detected, and compared well to Sanger                       alleles) was tested by running abritAMR on synthetic reads from
sequencing (carbapenemase allele calling) with 355/356 (99.7%) alleles                 complete reference genomes, and comparing to the (native) AMRFin-
correctly identiﬁed by WGS. After discrepancy resolution (including                    derPlus results on the complete genome, considered the ‘gold stan-
repeat PCR and/or WGS, or examination of partial genes detected by                     dard’ (Fig. 3). Overall accuracy of AMR gene detection by abritAMR was
abritAMR), ﬁve discrepancies between PCR and WGS results remained,                     excellent, with 133127/133215 alleles called correctly, resulting in 99.9%
including three potential false negatives (PCR positive, WGS negative)                 accuracy (95% CI 99.9-99.9%), 97.5% sensitivity (96.9-98.0%), and 100%
consisting of one CTX-M and two CMY genes not detected by abri-                        sensitivity (100-100%) (Fig. 5). Note that any discrepancies here include
tAMR; at least one of these was due to the presence of a contig break in               differences in abritAMR performance compared to AMRFinderPlus, as
the gene leading to smaller fragments not detected by AMRFinderPlus.                   well as differences between complete genomes and (synthetic) short-
Additionally, two potential false positives (PCR negative, WGS posi-                   read data, which likely accounts for at least a proportion of the dis-
tive) were identiﬁed, one CMY-42 and one IMP-62, conﬁrmed by repeat                    crepant results.
PCR and sequencing; both genes were reported to be within the                                The majority of discrepancies were false negatives, with the ami-
inclusivity range of the assay as per the manufacturer’s instructions,                 noglycoside AMR genes being most common (32/88, 36.4%), especially
although this was validated by in silico PCR by the manufacturer (and                  the aac(6’)-Ib family, implicated in 18 false negatives, and speciﬁcally
observed in our dataset). Alternatively, these discrepancies may be due                the aac(6’)-Ib-cr5 allele (11/18). Some of these were detected as partial
to plasmid dropout in culture (which is commonly observed with                         genes at the site of contig breaks, possibly related to slightly higher GC