BVBRC-07-Sherry-AMR-workflow-2023/results/amrfinder/GCA_001456055.3.tsv

Protein id	Contig id	Start	Stop	Strand	Element symbol	Element name	Scope	Type	Subtype	Class	Subclass	Method	Target length	Reference sequence length	% Coverage of reference	% Identity to reference	Alignment length	Closest reference accession	Closest reference name	HMM accession	HMM description
NA	CP012987.1	165363	166220	+	blaSHV-27	broad-spectrum class A beta-lactamase SHV-27	core	AMR	AMR	BETA-LACTAM	BETA-LACTAM	ALLELEX	286	286	100.00	100.00	286	WP_023282555.1	broad-spectrum class A beta-lactamase SHV-27	NA	NA
NA	CP012987.1	1001062	1002291	-	kdeA	multidrug efflux MFS transporter KdeA	plus	AMR	AMR	EFFLUX	EFFLUX	BLASTX	410	410	100.00	99.76	410	ABR76310.1	multidrug efflux MFS transporter KdeA	NA	NA
NA	CP012987.1	2088286	2088702	-	fosA	FosA5 family fosfomycin resistance glutathione transferase	core	AMR	AMR	FOSFOMYCIN	FOSFOMYCIN	BLASTX	139	139	100.00	99.28	139	WP_004146118.1	FosA5 family fosfomycin resistance glutathione transferase	NA	NA
NA	CP012987.1	2674563	2675462	-	fieF	CDF family cation-efflux transporter FieF	plus	STRESS	METAL	NA	NA	EXACTX	300	300	100.00	100.00	300	BAB89353.1	CDF family cation-efflux transporter FieF	NA	NA
NA	CP012987.1	2814104	2815285	-	emrD	multidrug efflux MFS transporter EmrD	plus	AMR	AMR	EFFLUX	EFFLUX	BLASTX	394	394	100.00	99.49	394	ACN65732.1	multidrug efflux MFS transporter EmrD	NA	NA
NA	CP012987.1	3969595	3972744	-	oqxB	multidrug efflux RND transporter permease subunit OqxB	core	AMR	AMR	NITROFURAN/PHENICOL/QUINOLONE/TETRACYCLINE	NITROFURANTOIN/PHENICOL/QUINOLONE/TIGECYCLINE	BLASTX	1050	1050	100.00	99.81	1050	WP_004149399.1	multidrug efflux RND transporter permease subunit OqxB19	NA	NA
NA	CP012987.1	3972771	3973943	-	oqxA	multidrug efflux RND transporter periplasmic adaptor subunit OqxA	core	AMR	AMR	NITROFURAN/PHENICOL/QUINOLONE/TETRACYCLINE	NITROFURANTOIN/PHENICOL/QUINOLONE/TIGECYCLINE	EXACTX	391	391	100.00	100.00	391	WP_002914189.1	multidrug efflux RND transporter periplasmic adaptor subunit OqxA	NA	NA
NA	CP012988.3	80731	81927	+	tet(A)	tetracycline efflux MFS transporter Tet(A)	core	AMR	AMR	TETRACYCLINE	TETRACYCLINE	EXACTX	399	399	100.00	100.00	399	WP_000804064.1	tetracycline efflux MFS transporter Tet(A)	NA	NA
NA	CP012988.3	90158	90799	+	qnrB1	quinolone resistance pentapeptide repeat protein QnrB1	core	AMR	AMR	QUINOLONE	QUINOLONE	ALLELEX	214	214	100.00	100.00	214	WP_014386481.1	quinolone resistance pentapeptide repeat protein QnrB1	NA	NA
NA	CP012988.3	94094	94564	+	dfrA14	trimethoprim-resistant dihydrofolate reductase DfrA14	core	AMR	AMR	TRIMETHOPRIM	TRIMETHOPRIM	EXACTX	157	157	100.00	100.00	157	WP_004201280.1	trimethoprim-resistant dihydrofolate reductase DfrA14	NA	NA
NA	CP012988.3	103187	104059	-	blaCTX-M-15	extended-spectrum class A beta-lactamase CTX-M-15	core	AMR	AMR	BETA-LACTAM	CEPHALOSPORIN	ALLELEX	291	291	100.00	100.00	291	WP_000239590.1	extended-spectrum class A beta-lactamase CTX-M-15	NA	NA
NA	CP012988.3	106881	107738	+	blaTEM-1	broad-spectrum class A beta-lactamase TEM-1	core	AMR	AMR	BETA-LACTAM	BETA-LACTAM	ALLELEX	286	286	100.00	100.00	286	WP_000027057.1	broad-spectrum class A beta-lactamase TEM-1	NA	NA
NA	CP012988.3	108465	109298	-	aph(6)-Id	aminoglycoside O-phosphotransferase APH(6)-Id	core	AMR	AMR	AMINOGLYCOSIDE	STREPTOMYCIN	EXACTX	278	278	100.00	100.00	278	WP_000480968.1	aminoglycoside O-phosphotransferase APH(6)-Id	NA	NA
NA	CP012988.3	109301	110101	-	aph(3'')-Ib	aminoglycoside O-phosphotransferase APH(3'')-Ib	core	AMR	AMR	AMINOGLYCOSIDE	STREPTOMYCIN	EXACTX	267	267	100.00	100.00	267	WP_001082319.1	aminoglycoside O-phosphotransferase APH(3'')-Ib	NA	NA
NA	CP012988.3	110165	110977	-	sul2	sulfonamide-resistant dihydropteroate synthase Sul2	core	AMR	AMR	SULFONAMIDE	SULFONAMIDE	EXACTX	271	271	100.00	100.00	271	WP_001043260.1	sulfonamide-resistant dihydropteroate synthase Sul2	NA	NA
NA	CP012989.1	10388	13174	-	clpK	heat shock survival AAA family ATPase ClpK	plus	STRESS	HEAT	NA	NA	BLASTX	929	949	97.89	99.25	929	ASF80763.1	heat shock survival AAA family ATPase ClpK	NA	NA
NA	CP012989.1	13283	13849	-	hsp20	small heat shock protein sHSP20	plus	STRESS	HEAT	NA	NA	EXACTX	189	189	100.00	100.00	189	CDY80020.1	small heat shock protein sHSP20	NA	NA
NA	CP012989.1	51784	52206	-	arsC	glutaredoxin-dependent arsenate reductase	plus	STRESS	METAL	ARSENIC	ARSENATE	BLASTX	141	141	100.00	92.91	141	AAA21096.1	glutaredoxin-dependent arsenate reductase	NA	NA
NA	CP012989.1	55736	56086	-	arsR	As(III)-sensing metalloregulatory transcriptional repressor ArsR	plus	STRESS	METAL	ARSENIC	ARSENIC	BLASTX	117	117	100.00	90.60	117	AAB09624.1	As(III)-sensing metalloregulatory transcriptional repressor ArsR	NA	NA
NA	CP012989.1	95165	95593	-	silE	silver-binding protein SilE	plus	STRESS	METAL	SILVER	SILVER	BLASTX	143	143	100.00	97.20	143	AAD11743.1	silver-binding protein SilE	NA	NA
NA	CP012989.1	95847	97319	-	silS	copper/silver sensor histidine kinase SilS	plus	STRESS	METAL	COPPER/SILVER	COPPER/SILVER	BLASTX	491	491	100.00	98.98	491	SPD96882.1	copper/silver sensor histidine kinase SilS	NA	NA
NA	CP012989.1	97315	97992	-	silR	copper/silver response regulator transcription factor SilR	plus	STRESS	METAL	COPPER/SILVER	COPPER/SILVER	BLASTX	226	226	100.00	98.23	226	SPD96883.1	copper/silver response regulator transcription factor SilR	NA	NA
NA	CP012989.1	98182	99564	+	silC	Cu(+)/Ag(+) efflux RND transporter outer membrane channel SilC	plus	STRESS	METAL	COPPER/SILVER	COPPER/SILVER	BLASTX	461	461	100.00	98.26	461	SPD96884.1	Cu(+)/Ag(+) efflux RND transporter outer membrane channel SilC	NA	NA
NA	CP012989.1	99596	99946	+	silF	Cu(+)/Ag(+) efflux RND transporter periplasmic metallochaperone SilF	plus	STRESS	METAL	COPPER/SILVER	COPPER/SILVER	BLASTX	117	117	100.00	99.15	117	KGL71342.1	Cu(+)/Ag(+) efflux RND transporter periplasmic metallochaperone SilF	NA	NA
NA	CP012989.1	100063	101352	+	silB	Cu(+)/Ag(+) efflux RND transporter periplasmic adaptor subunit SilB	plus	STRESS	METAL	COPPER/SILVER	COPPER/SILVER	BLASTX	430	430	100.00	97.91	430	AAD11748.1	Cu(+)/Ag(+) efflux RND transporter periplasmic adaptor subunit SilB	NA	NA
NA	CP012989.1	101366	104509	+	silA	Cu(+)/Ag(+) efflux RND transporter permease subunit SilA	plus	STRESS	METAL	COPPER/SILVER	COPPER/SILVER	BLASTX	1048	1048	100.00	98.85	1048	AAD11749.1	Cu(+)/Ag(+) efflux RND transporter permease subunit SilA	NA	NA
NA	CP012989.1	105145	107610	+	silP	Ag(+)-translocating P-type ATPase SilP	plus	STRESS	METAL	SILVER	SILVER	BLASTX	822	824	99.64	94.53	823	AAD11750.1	Ag(+)-translocating P-type ATPase SilP	NA	NA
NA	CP012989.1	109594	111408	+	pcoA	multicopper oxidase PcoA	plus	STRESS	METAL	COPPER	COPPER	EXACTX	605	605	100.00	100.00	605	CAA58525.1	multicopper oxidase PcoA	NA	NA
NA	CP012989.1	111417	112304	+	pcoB	copper-binding protein PcoB	plus	STRESS	METAL	COPPER	COPPER	BLASTX	296	296	100.00	99.66	296	CAA58526.1	copper-binding protein PcoB	NA	NA
NA	CP012989.1	112347	112724	+	pcoC	copper resistance system metallochaperone PcoC	plus	STRESS	METAL	COPPER	COPPER	EXACTX	126	126	100.00	100.00	126	CAA58527.1	copper resistance system metallochaperone PcoC	NA	NA
NA	CP012989.1	112732	113658	+	pcoD	copper resistance inner membrane protein PcoD	plus	STRESS	METAL	COPPER	COPPER	BLASTX	309	309	100.00	99.68	309	CAA58528.1	copper resistance inner membrane protein PcoD	NA	NA
NA	CP012989.1	113716	114393	+	pcoR	copper response regulator transcription factor PcoR	plus	STRESS	METAL	COPPER	COPPER	EXACTX	226	226	100.00	100.00	226	CAA58529.1	copper response regulator transcription factor PcoR	NA	NA
NA	CP012989.1	114393	115790	+	pcoS	copper resistance membrane spanning protein PcoS	plus	STRESS	METAL	COPPER	COPPER	BLASTX	466	466	100.00	99.36	466	CAA58530.1	copper resistance membrane spanning protein PcoS	NA	NA
NA	CP012989.1	122074	122496	-	arsC	glutaredoxin-dependent arsenate reductase	plus	STRESS	METAL	ARSENIC	ARSENATE	BLASTX	141	141	100.00	96.45	141	AAB09628.1	glutaredoxin-dependent arsenate reductase	NA	NA
NA	CP012989.1	122512	123798	-	arsB	arsenite efflux transporter membrane subunit ArsB	plus	STRESS	METAL	ARSENIC	ARSENITE	BLASTX	429	429	100.00	98.14	429	BAA24823.1	arsenite efflux transporter membrane subunit ArsB	NA	NA
NA	CP012989.1	123849	125597	-	arsA	arsenite efflux transporter ATPase subunit ArsA	plus	STRESS	METAL	ARSENIC	ARSENITE	BLASTX	583	583	100.00	93.65	583	AAB09626.1	arsenite efflux transporter ATPase subunit ArsA	NA	NA
NA	CP012989.1	125618	125977	-	arsD	arsenite efflux transporter metallochaperone ArsD	plus	STRESS	METAL	ARSENIC	ARSENITE	BLASTX	120	120	100.00	94.17	120	AAB09625.1	arsenite efflux transporter metallochaperone ArsD	NA	NA
NA	CP012989.1	126028	126378	-	arsR	As(III)-sensing metalloregulatory transcriptional repressor ArsR	plus	STRESS	METAL	ARSENIC	ARSENIC	EXACTX	117	117	100.00	100.00	117	AAB09624.1	As(III)-sensing metalloregulatory transcriptional repressor ArsR	NA	NA
NA	CP012990.1	16058	16420	-	ble	bleomycin binding protein Ble-MBL	core	AMR	AMR	BLEOMYCIN	BLEOMYCIN	EXACTX	121	121	100.00	100.00	121	WP_004201167.1	bleomycin binding protein Ble-MBL	NA	NA
NA	CP012990.1	16427	17236	-	blaNDM-7	subclass B1 metallo-beta-lactamase NDM-7	core	AMR	AMR	BETA-LACTAM	CARBAPENEM	ALLELEX	270	270	100.00	100.00	270	WP_032495622.1	subclass B1 metallo-beta-lactamase NDM-7	NA	NA

BVBRC-07-Sherry-AMR-workflow-2023/extraction/marker.md

classes that are notiﬁable as part of our national critical antimicrobial              suspected CPE isolates such as these), as different colonies with and
resistance surveillance system (CARAlert) in Australia17, with 99.9%                   without the ESBL/AmpC gene may have been picked for PCR and WGS,
accuracy (95% CI 99.9–100%), 98.9% sensitivity (98.3–99.3%) and 100%                   potentially explaining these discrepancies. No discrepant results were
speciﬁcity (100–100%) across these classes (carbapenemases, 16 S                       detected for mecA and van gene detection, and only one allele was
ribosomal methyltransferases, mobile colistin resistance genes, ESBLs                  incorrectly assigned compared to Sanger sequencing (99.7% accuracy)
(including AmpCs), vancomycin resistance genes, and oxazolidinone                      (Table 1 and Fig. 4). Overall performance of abritAMR against PCR
and phenicol resistance (optrA, cfr and poxtA genes)).                                 yielded 99.6% accuracy (95% CI 99.0-99.9%), 99.6% sensitivity (99.0-
                                                                                       99.9%) and 99.4% speciﬁcity (97.9-99.9%).
Validation results compared to PCR and Sanger sequencing
The abritAMR pipeline was highly accurate compared to PCR (carba-                      Identiﬁcation of AMR genes from synthetic reads
penemase, ESBL, van and mec gene PCRs) with 1179/1184 (99.6%)                          The presence or absence of 415 AMR genes across 321 genomes (133215
resistance genes correctly detected, and compared well to Sanger                       alleles) was tested by running abritAMR on synthetic reads from
sequencing (carbapenemase allele calling) with 355/356 (99.7%) alleles                 complete reference genomes, and comparing to the (native) AMRFin-
correctly identiﬁed by WGS. After discrepancy resolution (including                    derPlus results on the complete genome, considered the ‘gold stan-
repeat PCR and/or WGS, or examination of partial genes detected by                     dard’ (Fig. 3). Overall accuracy of AMR gene detection by abritAMR was
abritAMR), ﬁve discrepancies between PCR and WGS results remained,                     excellent, with 133127/133215 alleles called correctly, resulting in 99.9%
including three potential false negatives (PCR positive, WGS negative)                 accuracy (95% CI 99.9-99.9%), 97.5% sensitivity (96.9-98.0%), and 100%
consisting of one CTX-M and two CMY genes not detected by abri-                        sensitivity (100-100%) (Fig. 5). Note that any discrepancies here include
tAMR; at least one of these was due to the presence of a contig break in               differences in abritAMR performance compared to AMRFinderPlus, as
the gene leading to smaller fragments not detected by AMRFinderPlus.                   well as differences between complete genomes and (synthetic) short-
Additionally, two potential false positives (PCR negative, WGS posi-                   read data, which likely accounts for at least a proportion of the dis-
tive) were identiﬁed, one CMY-42 and one IMP-62, conﬁrmed by repeat                    crepant results.
PCR and sequencing; both genes were reported to be within the                                The majority of discrepancies were false negatives, with the ami-
inclusivity range of the assay as per the manufacturer’s instructions,                 noglycoside AMR genes being most common (32/88, 36.4%), especially
although this was validated by in silico PCR by the manufacturer (and                  the aac(6’)-Ib family, implicated in 18 false negatives, and speciﬁcally
observed in our dataset). Alternatively, these discrepancies may be due                the aac(6’)-Ib-cr5 allele (11/18). Some of these were detected as partial
to plasmid dropout in culture (which is commonly observed with                         genes at the site of contig breaks, possibly related to slightly higher GC